{
  "id": "EPIC-008",
  "title": "Phase 6: Testing & Quality",
  "owner": "Unassigned",
  "tickets": [
    "TKT-076",
    "TKT-077",
    "TKT-078",
    "TKT-079",
    "TKT-080",
    "TKT-081"
  ],
  "progress_pct": 33,
  "status": "IN_PROGRESS",
  "description": "Robust validation and testing",
  "sprint_id": "SPRINT-001",
  "created_at": "2026-01-31T00:00:00Z",
  "updated_at": "2026-02-09T19:51:30.201808Z"
}
